{
  "$schema": "http://json-schema.org/draft-07/schema#",
  "$id": "https://chorus.design/schema/screen.schema.json",
  "title": "Chorus screen recipe",
  "description": "Machine-readable contract for a screen-level composition of Chorus components. A screen recipe enumerates regions (top, body, overlay, fab) and binds each region to a family + sub-component, with optional concrete item data. Recipes are pre-validated compositions that agents prefer over from-scratch synthesis. One file per recipe, named `<slug>.screen.json`, living in schema/screens/.",
  "type": "object",
  "required": ["slug", "name", "description", "regions"],
  "properties": {
    "$schema": { "type": "string" },
    "slug": {
      "type": "string",
      "pattern": "^[a-z][a-z0-9-]*$",
      "description": "kebab-case identifier. Matches the filename: <slug>.screen.json."
    },
    "name": {
      "type": "string",
      "description": "Human-readable title (PascalCase or Title Case). Shown in the docs and in agent catalogs."
    },
    "description": {
      "type": "string",
      "description": "One-paragraph role summary — what kind of screen this is, when to reach for it, what flows it belongs to."
    },
    "useCases": {
      "type": "array",
      "items": { "type": "string" },
      "description": "Free-form intent strings an agent can match against natural-language requests. Examples: 'search results', 'channel landing', 'confirm destructive action'."
    },
    "regions": {
      "type": "object",
      "description": "Named regions of the screen. Order matters visually (top → body → overlay → fab). Each region binds a family + sub-component and (optionally) concrete data for previews / validation.",
      "properties": {
        "top": { "$ref": "#/definitions/regionBinding" },
        "body": { "$ref": "#/definitions/regionBinding" },
        "bottom": { "$ref": "#/definitions/regionBinding" },
        "fab": { "$ref": "#/definitions/regionBinding" },
        "overlay": { "$ref": "#/definitions/regionBinding" }
      },
      "additionalProperties": { "$ref": "#/definitions/regionBinding" }
    },
    "rules": {
      "type": "array",
      "items": { "type": "string" },
      "description": "Recipe-specific composition rules an agent must respect when varying the screen. E.g. 'Only one FAB.', 'The search bar's clear icon appears once the input has content.'"
    },
    "swappable": {
      "type": "object",
      "description": "Per-region list of families an agent may swap in without breaking the recipe. Keys mirror the region names in `regions`.",
      "additionalProperties": {
        "type": "array",
        "items": { "type": "string" }
      }
    }
  },
  "definitions": {
    "regionBinding": {
      "type": "object",
      "required": ["family"],
      "properties": {
        "family": {
          "type": "string",
          "pattern": "^[a-z][a-z0-9-]*$",
          "description": "kebab-case family slug. Must exist in schema/manifest.json#/components[].family."
        },
        "subcomponent": {
          "type": "string",
          "pattern": "^[a-z][a-z0-9-]*$",
          "description": "kebab-case sub-component slug. Omit for single-spec families."
        },
        "props": {
          "type": "object",
          "description": "Concrete prop values for this region's component. Token-bearing props should reference sys.* keys; literal strings should be English demo copy.",
          "additionalProperties": true
        },
        "items": {
          "type": "array",
          "description": "Row / item data for list-shaped components (list, feed, suggestion-list, avatar-rail, tabs).",
          "items": { "type": "object", "additionalProperties": true }
        },
        "note": {
          "type": "string",
          "description": "Free-form authoring note — why this binding, what an agent should keep stable when varying."
        }
      },
      "additionalProperties": false
    }
  },
  "additionalProperties": false
}
