{
  "$schema": "./screen.schema.json",
  "slug": "main-notifications",
  "name": "Main Notifications",
  "description": "Inbox-shaped surface for two parallel notification streams — 'What's New' (system updates) and 'Keywords' (keyword-matched posts). The active 'Keywords' tab is filter-heavy: users pre-narrow by keyword and channel before scanning. Each row points back to a post and uses a bell-in-coral leading glyph as the row-type marker.",
  "useCases": [
    "notifications inbox",
    "keyword-matched posts",
    "system updates",
    "filter notifications"
  ],
  "regions": {
    "top": {
      "family": "navigation-bar",
      "subcomponent": "page",
      "props": {
        "title": "Notifications",
        "leadingAction": "menu",
        "trailingActions": ["settings", "profile"]
      },
      "note": "page variant — leading menu, centered title, trailing settings cog + profile."
    },
    "tabs": {
      "family": "tabs",
      "subcomponent": "underline",
      "items": [
        { "label": "What's New" },
        { "label": "Keywords", "active": true }
      ]
    },
    "promo": {
      "family": "banner",
      "props": {
        "title": "Recruiters are looking at your profile",
        "body": "Turn on visibility to start getting messages.",
        "leading": "image"
      },
      "note": "Warm-surface promo banner sitting between the tabs and the filter row. Carries an illustration on the right; color pair travels together (AGENTS.md rule 2)."
    },
    "filters": {
      "family": "chip",
      "subcomponent": "filter",
      "items": [
        { "label": "All Keywords", "active": true, "trailing": "chevron-down" },
        { "label": "All Channels", "trailing": "chevron-down" },
        { "label": "Label" }
      ],
      "note": "Filter row. A trailing `button/text` 'Manage Keywords' lives at the end of the row — it is a navigation hint paired with filter scope, not a filter itself. Do not merge into the chip row as another chip."
    },
    "body": {
      "family": "list",
      "subcomponent": "text",
      "items": [
        {
          "leading": "bell",
          "label": "Tokens v2 published",
          "supportingText": "#design-system · 2h",
          "tag": "tokens"
        },
        {
          "leading": "bell",
          "label": "New post in #frontend",
          "supportingText": "#frontend · 4h",
          "tag": "react"
        }
      ],
      "note": "Hairline separators between rows, not full dividers. Bell-in-coral leading glyph is the row-type marker — not per-row state. Each row routes back to a post."
    },
    "bottom": {
      "family": "tab-bar",
      "items": [
        { "icon": "home",      "label": "Home" },
        { "icon": "building",  "label": "Company" },
        { "icon": "compass",   "label": "Explore" },
        { "icon": "briefcase", "label": "Jobs" },
        { "icon": "bell",      "label": "Notifications", "active": true },
        { "icon": "plus",      "label": "Create", "appearance": "primary" }
      ],
      "note": "Notifications tab active."
    }
  },
  "rules": [
    "'Manage Keywords' is `button/text` at the end of the chip row — not a chip. Do not merge into the filter set.",
    "Bell-in-coral leading glyph is the row-type marker, not state. Do not vary it per row to signal read/unread.",
    "Demo strings render English per AGENTS.md rule 7, even though the source pattern is Korean."
  ],
  "swappable": {
    "body": ["list", "feed"]
  }
}
