{
  "$schema": "./screen.schema.json",
  "slug": "post",
  "name": "Post Detail",
  "description": "Single-post detail view — full body, optional embedded poll, and a full toolbar of post-level actions (share, subscribe, bookmark, overflow) in the NavigationBar trailing cluster. Reader's primary action is to scroll, react, or vote; replies live on the paired `post-comments` recipe.",
  "useCases": [
    "post detail",
    "read a post",
    "vote in a poll",
    "view post actions"
  ],
  "regions": {
    "top": {
      "family": "navigation-bar",
      "subcomponent": "page",
      "props": {
        "title": "blind",
        "titleTone": "muted",
        "leadingAction": "back",
        "trailingActions": ["share", "subscribe", "bookmark", "overflow"]
      },
      "note": "page variant — leading back chevron, wordmark 'blind' muted in the title position (not a screen title — wordmark), trailing `button/toolbar` cluster."
    },
    "body": {
      "family": "feed",
      "items": [
        {
          "channel": "Channel 💞",
          "timestamp": "3h",
          "meta": "Acme · Senior PM · @ililliji",
          "avatar": { "family": "thumbnail" },
          "title": "Switching to Meta — pros and cons",
          "body": "Long-form body. Numbered list and inline links to entities (Meta is rendered as a tokenized entity link). Hashtags like #TC render in accent blue.",
          "single": true
        }
      ],
      "note": "Single-post body modeled as a one-item feed. The author block has two meta lines: 'channel · time', then 'workplace · role · username' — preserve both. Title at `sys.typo.display.md`; inline entity links and hashtag color are tokenized text styles, not arbitrary inline overrides."
    },
    "poll": {
      "family": "list",
      "subcomponent": "radio",
      "items": [
        { "leading": "radio", "label": "Stay at current company" },
        { "leading": "radio", "label": "Move to Meta" },
        { "leading": "radio", "label": "Take a sabbatical first" }
      ],
      "note": "Poll options inside a `callout`-shaped container with a leading coral Poll icon, 'Number Participants' header, and 'Select only one answer' helper. The callout surface is implicit in the poll region's chrome."
    },
    "notice": {
      "family": "callout",
      "props": {
        "body": "You cannot reply to flagged/deleted comment.",
        "leading": "info",
        "tone": "muted"
      },
      "note": "Persistent informational notice strip at the bottom of the scroll. Non-modal — do not model as a `toast`."
    }
  },
  "rules": [
    "Preserve both meta lines on the author block (channel·time, then workplace·role·username). Collapsing into one loses identity context that is load-bearing in Blind.",
    "The bottom notice strip is non-modal and persistent for this state — model as `callout`, not `toast`.",
    "'blind' wordmark in the nav title is muted and not a screen title — do not promote it to `sys.color.onSurface`.",
    "Inline entity underlines and hashtag color are tokenized text styles, not arbitrary `<span>` overrides."
  ]
}
